{
  "$schema": "https://json-schema.org/draft/2020-12/schema",
  "title": "Toy Store Revenue Leak Observatory DuckDB Stage IR",
  "type": "object",
  "required": [
    "id",
    "name",
    "objective",
    "read_first",
    "allowed_inputs",
    "required_outputs",
    "forbidden_patterns"
  ],
  "properties": {
    "id": {
      "type": "string"
    },
    "name": {
      "type": "string"
    },
    "objective": {
      "type": "string"
    },
    "read_first": {
      "type": "array",
      "items": {
        "type": "string"
      }
    },
    "allowed_inputs": {
      "type": "array",
      "items": {
        "type": "string"
      }
    },
    "required_outputs": {
      "type": "array",
      "items": {
        "type": "string"
      }
    },
    "forbidden_patterns": {
      "type": "array",
      "items": {
        "type": "string"
      }
    },
    "notes": {
      "type": "array",
      "items": {
        "type": "string"
      }
    }
  }
}
